[
  { "id": "srd-5.2:tool/alchemists-supplies", "name": "Alchemist's Supplies", "category": "artisan", "ability": "INT", "cost": {"amount": 50, "unit": "gp"}, "weight": 8, "utilize": [{"action": "Identify a substance", "dc": 15}, {"action": "Start a fire", "dc": 15}], "craft": ["srd-5.2:equipment/acid", "srd-5.2:equipment/alchemists-fire", "srd-5.2:equipment/component-pouch", "srd-5.2:equipment/oil", "srd-5.2:equipment/paper", "srd-5.2:equipment/perfume"] },
  { "id": "srd-5.2:tool/brewers-supplies", "name": "Brewer's Supplies", "category": "artisan", "ability": "INT", "cost": {"amount": 20, "unit": "gp"}, "weight": 9, "utilize": [{"action": "Detect poisoned drink", "dc": 15}, {"action": "Identify alcohol", "dc": 10}], "craft": ["srd-5.2:equipment/antitoxin"] },
  { "id": "srd-5.2:tool/calligraphers-supplies", "name": "Calligrapher's Supplies", "category": "artisan", "ability": "DEX", "cost": {"amount": 10, "unit": "gp"}, "weight": 5, "utilize": [{"action": "Write text with impressive flourishes that guard against forgery", "dc": 15}], "craft": ["srd-5.2:equipment/ink", "srd-5.2:equipment/spell-scroll"] },
  { "id": "srd-5.2:tool/carpenters-tools", "name": "Carpenter's Tools", "category": "artisan", "ability": "STR", "cost": {"amount": 8, "unit": "gp"}, "weight": 6, "utilize": [{"action": "Seal or pry open a door or container", "dc": 20}], "craft": ["srd-5.2:equipment/club", "srd-5.2:equipment/greatclub", "srd-5.2:equipment/quarterstaff", "srd-5.2:equipment/barrel", "srd-5.2:equipment/chest", "srd-5.2:equipment/ladder", "srd-5.2:equipment/pole", "srd-5.2:equipment/ram-portable", "srd-5.2:equipment/torch"] },
  { "id": "srd-5.2:tool/cartographers-tools", "name": "Cartographer's Tools", "category": "artisan", "ability": "WIS", "cost": {"amount": 15, "unit": "gp"}, "weight": 6, "utilize": [{"action": "Draft a map of a small area", "dc": 15}], "craft": ["srd-5.2:equipment/map"] },
  { "id": "srd-5.2:tool/cobblers-tools", "name": "Cobbler's Tools", "category": "artisan", "ability": "DEX", "cost": {"amount": 5, "unit": "gp"}, "weight": 5, "utilize": [{"action": "Modify footwear to give Advantage on the wearer's next Dexterity (Acrobatics) check", "dc": 10}], "craft": ["srd-5.2:equipment/climbers-kit"] },
  { "id": "srd-5.2:tool/cooks-utensils", "name": "Cook's Utensils", "category": "artisan", "ability": "WIS", "cost": {"amount": 1, "unit": "gp"}, "weight": 8, "utilize": [{"action": "Improve food's flavor", "dc": 10}, {"action": "Detect spoiled or poisoned food", "dc": 15}], "craft": ["srd-5.2:equipment/rations"] },
  { "id": "srd-5.2:tool/glassblowers-tools", "name": "Glassblower's Tools", "category": "artisan", "ability": "INT", "cost": {"amount": 30, "unit": "gp"}, "weight": 5, "utilize": [{"action": "Discern what a glass object held in the past 24 hours", "dc": 15}], "craft": ["srd-5.2:equipment/bottle-glass", "srd-5.2:equipment/magnifying-glass", "srd-5.2:equipment/spyglass", "srd-5.2:equipment/vial"] },
  { "id": "srd-5.2:tool/jewelers-tools", "name": "Jeweler's Tools", "category": "artisan", "ability": "INT", "cost": {"amount": 25, "unit": "gp"}, "weight": 2, "utilize": [{"action": "Discern a gem's value", "dc": 15}], "craft": ["srd-5.2:equipment/arcane-focus", "srd-5.2:equipment/holy-symbol"] },
  { "id": "srd-5.2:tool/leatherworkers-tools", "name": "Leatherworker's Tools", "category": "artisan", "ability": "DEX", "cost": {"amount": 5, "unit": "gp"}, "weight": 5, "utilize": [{"action": "Add a design to a leather item", "dc": 10}], "craft": ["srd-5.2:equipment/sling", "srd-5.2:equipment/whip", "srd-5.2:equipment/hide-armor", "srd-5.2:equipment/leather-armor", "srd-5.2:equipment/studded-leather-armor", "srd-5.2:equipment/backpack", "srd-5.2:equipment/case-crossbow-bolt", "srd-5.2:equipment/case-map-or-scroll", "srd-5.2:equipment/parchment", "srd-5.2:equipment/pouch", "srd-5.2:equipment/quiver", "srd-5.2:equipment/waterskin"] },
  { "id": "srd-5.2:tool/masons-tools", "name": "Mason's Tools", "category": "artisan", "ability": "STR", "cost": {"amount": 10, "unit": "gp"}, "weight": 8, "utilize": [{"action": "Chisel a symbol or hole in stone", "dc": 10}], "craft": ["srd-5.2:equipment/block-and-tackle"] },
  { "id": "srd-5.2:tool/painters-supplies", "name": "Painter's Supplies", "category": "artisan", "ability": "WIS", "cost": {"amount": 10, "unit": "gp"}, "weight": 5, "utilize": [{"action": "Paint a recognizable image of something you've seen", "dc": 10}], "craft": ["srd-5.2:equipment/druidic-focus", "srd-5.2:equipment/holy-symbol"] },
  { "id": "srd-5.2:tool/potters-tools", "name": "Potter's Tools", "category": "artisan", "ability": "INT", "cost": {"amount": 10, "unit": "gp"}, "weight": 3, "utilize": [{"action": "Discern what a ceramic object held in the past 24 hours", "dc": 15}], "craft": ["srd-5.2:equipment/jug", "srd-5.2:equipment/lamp"] },
  { "id": "srd-5.2:tool/smiths-tools", "name": "Smith's Tools", "category": "artisan", "ability": "STR", "cost": {"amount": 20, "unit": "gp"}, "weight": 8, "utilize": [{"action": "Pry open a door or container", "dc": 20}], "craft": [{"category": "weapon", "except": ["srd-5.2:equipment/club", "srd-5.2:equipment/greatclub", "srd-5.2:equipment/quarterstaff", "srd-5.2:equipment/whip"], "attackRanges": ["melee"]}, {"category": "armor", "except": ["srd-5.2:equipment/hide-armor"], "armorCategories": ["mediumArmor"]}, {"category": "armor", "armorCategories": ["heavyArmor"]}, "srd-5.2:equipment/ball-bearings", "srd-5.2:equipment/bucket", "srd-5.2:equipment/caltrops", "srd-5.2:equipment/chain", "srd-5.2:equipment/crowbar", "srd-5.2:equipment/bullets-firearm", "srd-5.2:equipment/grappling-hook", "srd-5.2:equipment/pot-iron", "srd-5.2:equipment/spikes-iron", "srd-5.2:equipment/bullets-sling"] },
  { "id": "srd-5.2:tool/tinkers-tools", "name": "Tinker's Tools", "category": "artisan", "ability": "DEX", "cost": {"amount": 50, "unit": "gp"}, "weight": 10, "utilize": [{"action": "Assemble a Tiny item composed of scrap, which falls apart in 1 minute", "dc": 20}], "craft": ["srd-5.2:equipment/musket", "srd-5.2:equipment/pistol", "srd-5.2:equipment/bell", "srd-5.2:equipment/lantern-bullseye", "srd-5.2:equipment/flask", "srd-5.2:equipment/lantern-hooded", "srd-5.2:equipment/hunting-trap", "srd-5.2:equipment/lock", "srd-5.2:equipment/manacles", "srd-5.2:equipment/mirror", "srd-5.2:equipment/shovel", "srd-5.2:equipment/signal-whistle", "srd-5.2:equipment/tinderbox"] },
  { "id": "srd-5.2:tool/weavers-tools", "name": "Weaver's Tools", "category": "artisan", "ability": "DEX", "cost": {"amount": 1, "unit": "gp"}, "weight": 5, "utilize": [{"action": "Mend a tear in clothing", "dc": 10}, {"action": "Sew a Tiny design", "dc": 10}], "craft": ["srd-5.2:equipment/padded-armor", "srd-5.2:equipment/basket", "srd-5.2:equipment/bedroll", "srd-5.2:equipment/blanket", "srd-5.2:equipment/clothes-fine", "srd-5.2:equipment/net", "srd-5.2:equipment/robe", "srd-5.2:equipment/rope", "srd-5.2:equipment/sack", "srd-5.2:equipment/string", "srd-5.2:equipment/tent", "srd-5.2:equipment/clothes-travelers"] },
  { "id": "srd-5.2:tool/woodcarvers-tools", "name": "Woodcarver's Tools", "category": "artisan", "ability": "DEX", "cost": {"amount": 1, "unit": "gp"}, "weight": 5, "utilize": [{"action": "Carve a pattern in wood", "dc": 10}], "craft": ["srd-5.2:equipment/club", "srd-5.2:equipment/greatclub", "srd-5.2:equipment/quarterstaff", {"category": "weapon", "except": ["srd-5.2:equipment/pistol", "srd-5.2:equipment/musket", "srd-5.2:equipment/sling"], "attackRanges": ["ranged"]}, "srd-5.2:equipment/arcane-focus", "srd-5.2:equipment/arrows", "srd-5.2:equipment/bolts", "srd-5.2:equipment/druidic-focus", "srd-5.2:equipment/ink-pen", "srd-5.2:equipment/needles"] },
  { "id": "srd-5.2:tool/disguise-kit", "name": "Disguise Kit", "category": "kit", "ability": "CHA", "cost": {"amount": 25, "unit": "gp"}, "weight": 3, "utilize": [{"action": "Apply makeup", "dc": 10}], "craft": ["srd-5.2:equipment/costume"] },
  { "id": "srd-5.2:tool/forgery-kit", "name": "Forgery Kit", "category": "kit", "ability": "DEX", "cost": {"amount": 15, "unit": "gp"}, "weight": 5, "utilize": [{"action": "Mimic 10 or fewer words of someone else's handwriting", "dc": 15}, {"action": "Duplicate a wax seal", "dc": 20}] },
  { "id": "srd-5.2:tool/herbalism-kit", "name": "Herbalism Kit", "category": "kit", "ability": "INT", "cost": {"amount": 5, "unit": "gp"}, "weight": 3, "utilize": [{"action": "Identify a plant", "dc": 10}], "craft": ["srd-5.2:equipment/antitoxin", "srd-5.2:equipment/candle", "srd-5.2:equipment/healers-kit", "srd-5.2:equipment/potion-of-healing"] },
  { "id": "srd-5.2:tool/poisoners-kit", "name": "Poisoner's Kit", "category": "kit", "ability": "INT", "cost": {"amount": 50, "unit": "gp"}, "weight": 2, "utilize": [{"action": "Detect a poisoned object", "dc": 10}], "craft": ["srd-5.2:equipment/poison-basic"] },
  { "id": "srd-5.2:tool/navigators-tools", "name": "Navigator's Tools", "category": "other", "ability": "WIS", "cost": {"amount": 25, "unit": "gp"}, "weight": 2, "utilize": [{"action": "Plot a course", "dc": 10}, {"action": "Determine position by stargazing", "dc": 15}] },
  { "id": "srd-5.2:tool/thieves-tools", "name": "Thieves' Tools", "category": "other", "ability": "DEX", "cost": {"amount": 25, "unit": "gp"}, "weight": 1, "utilize": [{"action": "Pick a lock", "dc": 15}, {"action": "Disarm a trap", "dc": 15}] },
  { "id": "srd-5.2:tool/gaming-set", "name": "Gaming Set", "category": "gaming", "variants": [{"slug": "dice", "name": "Dice", "cost": {"amount": 1, "unit": "sp"}}, {"slug": "dragonchess", "name": "Dragonchess", "cost": {"amount": 1, "unit": "gp"}}, {"slug": "playing-cards", "name": "Playing cards", "cost": {"amount": 5, "unit": "sp"}}, {"slug": "three-dragon-ante", "name": "Three-dragon ante", "cost": {"amount": 1, "unit": "gp"}}], "utilize": [{"action": "Discern whether someone is cheating", "dc": 10}, {"action": "Win the game", "dc": 20}] },